{
  "$schema": "https://get.au.tomat.ing/schemas/tomat-v1.json",
  "name": "tomat-extension-samples",
  "displayName": "Samples",
  "description": "A showcase of every capability a Tomat extension can use, with one small single-purpose tool per capability for authors to learn from.",
  "license": "MIT",
  "homepage": "https://au.tomat.ing",
  "database": true,
  "tools": [
    {
      "name": "sample_choice",
      "description": "Demonstrate the choice question kind: a free-text prompt, a single-select, and a multiselect that also allows freeform input. Returns the collected answers.",
      "parameters": {
        "type": "object",
        "properties": {}
      },
      "triggers": [
        "show me the choice sample",
        "demo asking the user some questions",
        "run the choice question example"
      ],
      "function": "sampleChoice",
      "alwaysAvailable": true,
      "permissions": {}
    },
    {
      "name": "sample_diff",
      "description": "Demonstrate the diff question kind: present a before/after change and report whether the user accepted it.",
      "parameters": {
        "type": "object",
        "properties": {}
      },
      "triggers": [
        "show me the diff sample",
        "demo a diff confirmation",
        "run the diff question example"
      ],
      "function": "sampleDiff",
      "permissions": {}
    },
    {
      "name": "sample_files",
      "description": "Demonstrate the files question kind: offer a multiselect file picker with example entries and report which were chosen.",
      "parameters": {
        "type": "object",
        "properties": {}
      },
      "triggers": [
        "show me the files sample",
        "demo a file picker",
        "run the files question example"
      ],
      "function": "sampleFiles",
      "platforms": ["darwin", "windows", "linux"],
      "permissions": {}
    },
    {
      "name": "sample_image",
      "description": "Demonstrate the image question kind: show a sample image with keep and discard actions and report which action was chosen.",
      "parameters": {
        "type": "object",
        "properties": {}
      },
      "triggers": [
        "show me the image sample",
        "demo an image confirmation",
        "run the image question example"
      ],
      "function": "sampleImage",
      "permissions": {}
    },
    {
      "name": "sample_table",
      "description": "Demonstrate the table question kind plus the private database: review some proposed rows, then save the accepted rows into the extension's database.",
      "parameters": {
        "type": "object",
        "properties": {
          "columns": {
            "type": "array",
            "items": { "type": "string" },
            "description": "Column headers for the table. Defaults to [\"item\", \"amount\"]."
          }
        }
      },
      "triggers": [
        "show me the table sample",
        "demo an editable table",
        "run the table question example"
      ],
      "function": "sampleTable",
      "permissions": {}
    },
    {
      "name": "sample_display",
      "description": "Demonstrate the one-way display pushes: push one markdown, image, table, and diff bubble into the chat. Returns how many were pushed.",
      "parameters": {
        "type": "object",
        "properties": {}
      },
      "triggers": [
        "show me the display sample",
        "demo the display kinds",
        "run the display example"
      ],
      "function": "sampleDisplay",
      "alwaysAvailable": true,
      "permissions": {}
    },
    {
      "name": "sample_database",
      "description": "Demonstrate the private database: upsert a key and value, then read it back. Shows the SQLite the extension's database flag provisions.",
      "parameters": {
        "type": "object",
        "properties": {
          "key": {
            "type": "string",
            "description": "Key to store. Defaults to \"greeting\"."
          },
          "value": {
            "type": "string",
            "description": "Value to store under the key. Defaults to \"hello\"."
          }
        }
      },
      "triggers": [
        "show me the database sample",
        "demo storing a value",
        "run the database example"
      ],
      "function": "sampleDatabase",
      "permissions": {}
    },
    {
      "name": "sample_llm",
      "description": "Demonstrate the llm capability: run a single completion against the user's configured model and return its text.",
      "parameters": {
        "type": "object",
        "properties": {
          "prompt": {
            "type": "string",
            "description": "Prompt to complete. Defaults to a short hello."
          }
        }
      },
      "triggers": ["show me the llm sample", "demo a model completion", "run the llm example"],
      "function": "sampleLlm",
      "permissions": {
        "llm": [
          {
            "reason": "Run a sample completion against the configured model"
          }
        ]
      }
    },
    {
      "name": "sample_tts",
      "description": "Demonstrate the tts capability: synthesize speech from text and report the audio format and size (not the audio itself).",
      "parameters": {
        "type": "object",
        "properties": {
          "text": {
            "type": "string",
            "description": "Text to speak. Defaults to a short greeting."
          }
        }
      },
      "triggers": ["show me the tts sample", "demo text to speech", "run the tts example"],
      "function": "sampleTts",
      "permissions": {
        "tts": [
          {
            "reason": "Synthesize a short sample of speech from text"
          }
        ]
      }
    },
    {
      "name": "sample_stt",
      "description": "Demonstrate the stt capability: transcribe audio to text and return the transcript.",
      "parameters": {
        "type": "object",
        "properties": {
          "dataB64": {
            "type": "string",
            "description": "Base64-encoded audio to transcribe."
          },
          "mime": {
            "type": "string",
            "description": "MIME type of the audio, e.g. \"audio/wav\"."
          }
        }
      },
      "triggers": ["show me the stt sample", "demo speech to text", "run the stt example"],
      "function": "sampleStt",
      "permissions": {
        "stt": [
          {
            "reason": "Transcribe a sample of audio to text"
          }
        ]
      }
    },
    {
      "name": "sample_schedule",
      "description": "Demonstrate scheduling: propose an interval scheduled prompt for the user to review, and report whether it was accepted.",
      "parameters": {
        "type": "object",
        "properties": {
          "everyMinutes": {
            "type": "integer",
            "description": "Minutes between runs for the proposed schedule. Defaults to 60."
          }
        }
      },
      "triggers": [
        "show me the schedule sample",
        "demo scheduling a prompt",
        "run the schedule example"
      ],
      "function": "sampleSchedule",
      "permissions": {}
    },
    {
      "name": "sample_memory",
      "description": "Demonstrate the memories capability: list existing memories, write a sample memory, then read it back. Returns the titles seen and the stored content.",
      "parameters": {
        "type": "object",
        "properties": {
          "title": {
            "type": "string",
            "description": "Title for the sample memory. Defaults to \"Sample note\"."
          },
          "content": {
            "type": "string",
            "description": "Content for the sample memory."
          }
        }
      },
      "triggers": ["show me the memory sample", "demo writing a memory", "run the memory example"],
      "function": "sampleMemory",
      "permissions": {
        "memories": [
          {
            "access": "read",
            "reason": "List existing memories and read back the sample memory"
          },
          {
            "access": "write",
            "reason": "Write a sample memory"
          }
        ]
      }
    }
  ],
  "memories": [
    { "kind": "knowledge", "path": "memories/tomat-overview.md" },
    { "kind": "skill", "path": "memories/web-research" }
  ]
}
